{
  "schema": "apocky.public-surface.v1",
  "schema_href": "/schemas/public-surface.v1.json",
  "canonical_origin": "https://www.apocky.com",
  "generated_from": "lib/public-surface-graph.ts",
  "nodes": [
    {
      "id": "tools",
      "title": "Tools to try",
      "summary": "Choose a tool to make a sigil, build an intention, get a reading, or find a meaning.",
      "href": "/tools",
      "external": false,
      "availability": "public",
      "kind": "creative_project",
      "axes": [
        "People",
        "Meaning",
        "Time"
      ],
      "coordinates": {
        "People": "Choose a tool",
        "Meaning": "Choose a tool to make a sigil, build an intention, get a reading, or find a meaning.",
        "Visibility": "Public",
        "Time": "Available to explore"
      }
    },
    {
      "id": "codex-apockalypsis",
      "title": "Codex Apockalypsis · The Good Book",
      "summary": "Read The Good Book as dark fantasy and dark comedy. Explore the Omnoid, Lilith, characters, maps, and companion Codex.",
      "href": "/codex-apockalypsis",
      "external": false,
      "availability": "public",
      "kind": "archive",
      "axes": [
        "People",
        "Meaning",
        "Time"
      ],
      "coordinates": {
        "People": "Begin reading",
        "Meaning": "Read The Good Book as dark fantasy and dark comedy. Explore the Omnoid, Lilith, characters, maps, and companion Codex.",
        "Visibility": "Public",
        "Time": "Opening available; the series is being written"
      }
    },
    {
      "id": "conversations",
      "title": "Thoughts & conversations",
      "summary": "Read short pieces about myth, meaning, creativity, consciousness, and being human.",
      "href": "/conversations",
      "external": false,
      "availability": "public",
      "kind": "archive",
      "axes": [
        "People",
        "Meaning",
        "Time"
      ],
      "coordinates": {
        "People": "Explore the ideas",
        "Meaning": "Read short pieces about myth, meaning, creativity, consciousness, and being human.",
        "Visibility": "Public",
        "Time": "Available to explore"
      }
    },
    {
      "id": "apocrypha",
      "title": "Talk with Apocrypha",
      "summary": "Ask a question with no account; sign in to keep your conversations across devices.",
      "href": "/apocrypha",
      "external": false,
      "availability": "public",
      "kind": "community",
      "axes": [
        "People",
        "Meaning",
        "Time"
      ],
      "coordinates": {
        "People": "Talk with Apocrypha",
        "Meaning": "Ask a question with no account; sign in to keep your conversations across devices.",
        "Visibility": "Open to everyone",
        "Time": "Available to explore"
      }
    },
    {
      "id": "apps",
      "title": "Get the Apocrypha app",
      "summary": "Find the available app download and installation instructions.",
      "href": "/download/apocrypha",
      "external": false,
      "availability": "public",
      "kind": "reference",
      "axes": [
        "People",
        "Meaning",
        "Time"
      ],
      "coordinates": {
        "People": "Get the app",
        "Meaning": "Find the available app download and installation instructions.",
        "Visibility": "Public",
        "Time": "Available to explore"
      }
    },
    {
      "id": "home",
      "title": "Apocky",
      "summary": "Tools to try, words to understand, and thoughts and stories from Shawn Apocky.",
      "href": "/",
      "external": false,
      "availability": "public",
      "kind": "orientation",
      "axes": [
        "People",
        "Meaning"
      ],
      "coordinates": {
        "People": "A visitor-led starting point",
        "Meaning": "Creative home and project index",
        "Visibility": "Public",
        "Time": "Updated as the work changes"
      }
    },
    {
      "id": "atlas",
      "title": "Browse Apocky",
      "summary": "Find every tool, reading, and project in one searchable directory.",
      "href": "/atlas",
      "external": false,
      "availability": "public",
      "kind": "orientation",
      "axes": [
        "People",
        "Meaning",
        "Visibility",
        "Time"
      ],
      "coordinates": {
        "People": "Choose a destination or relationship",
        "Meaning": "Map, index, and dictionary",
        "Visibility": "Public",
        "Time": "A living orientation layer"
      }
    },
    {
      "id": "showcase",
      "title": "Apocky + Chaos Tarot Showcase",
      "summary": "A captioned 23-second illustrated passage between the Apocky Atlas and the free Chaos Tarot reading experience.",
      "href": "/showcase",
      "external": false,
      "availability": "public",
      "kind": "creative_project",
      "axes": [
        "People",
        "Meaning",
        "Visibility",
        "Time"
      ],
      "coordinates": {
        "People": "Watch, read the transcript, or choose a public destination",
        "Meaning": "An illustrated orientation between two independent live sites",
        "Visibility": "Public; concept art is explicitly labeled and playback is visitor-controlled",
        "Time": "A 23-second captioned film with landscape and portrait formats"
      }
    },
    {
      "id": "start",
      "title": "Start here",
      "summary": "Pick something to make, read, or explore.",
      "href": "/start",
      "external": false,
      "availability": "public",
      "kind": "orientation",
      "axes": [
        "People",
        "Meaning",
        "Time"
      ],
      "coordinates": {
        "People": "Choose the purpose that brought you here",
        "Meaning": "Guided entry into the public constellation",
        "Visibility": "Public with no quiz or email gate",
        "Time": "A starting route you can leave at any point"
      }
    },
    {
      "id": "quests",
      "title": "Things to try",
      "summary": "Follow a small challenge through the tools and ideas here. Keep your progress in this browser.",
      "href": "/quests",
      "external": false,
      "availability": "public",
      "kind": "orientation",
      "axes": [
        "People",
        "Meaning",
        "Time"
      ],
      "coordinates": {
        "People": "Choose, complete, or reset your own route",
        "Meaning": "A guided traversal of public work",
        "Visibility": "Public; progress stays in this browser",
        "Time": "Eleven missions with reversible local progress"
      }
    },
    {
      "id": "status",
      "title": "Service status",
      "summary": "Check whether a service is available and find help if something is not working.",
      "href": "/status",
      "external": false,
      "availability": "public",
      "kind": "reference",
      "axes": [
        "Visibility",
        "Time"
      ],
      "coordinates": {
        "People": "Run a same-origin health check or choose a fallback",
        "Meaning": "Public status and recovery routes",
        "Visibility": "Public, without keys or private logs",
        "Time": "Observed when the page checks the health endpoint"
      }
    },
    {
      "id": "divination",
      "title": "Chaos, Tarot, and Divination",
      "summary": "A grounded guide to eight symbolic systems, what reflective readings can do, and what they cannot establish.",
      "href": "/divination",
      "external": false,
      "availability": "public",
      "kind": "reference",
      "axes": [
        "Meaning",
        "Time",
        "People"
      ],
      "coordinates": {
        "People": "Learn, reflect, or choose a free external reading",
        "Meaning": "Tarot and divination with an explicit epistemic boundary",
        "Visibility": "Public on apocky.com",
        "Time": "Readings inform reflection rather than guaranteeing a future"
      }
    },
    {
      "id": "oracle",
      "title": "Yes / No Oracle",
      "summary": "Ask a yes-or-no question on Chaos Tarot. Sign-in is required.",
      "href": "https://chaos-tarot.com/yes-no",
      "external": true,
      "availability": "account_required",
      "kind": "game",
      "axes": [
        "People",
        "Meaning",
        "Visibility",
        "Time"
      ],
      "coordinates": {
        "People": "You ask; the generated signal does not take decision authority",
        "Meaning": "Yes or no as reflective friction, not guaranteed prediction",
        "Visibility": "Opens Chaos Tarot, which requires its own sign-in",
        "Time": "Use a reading as a prompt to consider your next choice"
      }
    },
    {
      "id": "spellcraft",
      "title": "Build an intention",
      "summary": "Choose words for growth, protection, change, and more. Create an intention and turn it into a sigil.",
      "href": "/spellcraft",
      "external": false,
      "availability": "public",
      "kind": "language",
      "axes": [
        "People",
        "Meaning",
        "Visibility",
        "Time"
      ],
      "coordinates": {
        "People": "You author and inspect every term before choosing to save",
        "Meaning": "Language becomes a non-executable symbolic plan and interpretation",
        "Visibility": "Input stays local; unknown and ambiguous forms are quarantined",
        "Time": "Versioned engine, vocabulary, hashes, and reproducible receipt"
      }
    },
    {
      "id": "sigils",
      "title": "Make a sigil",
      "summary": "Choose a meaning, create your symbol, and download the image.",
      "href": "/sigils",
      "external": false,
      "availability": "public",
      "kind": "creative_project",
      "axes": [
        "People",
        "Meaning",
        "Visibility",
        "Time"
      ],
      "coordinates": {
        "People": "Choose the text and visible variant; download only when ready",
        "Meaning": "Morphemes map to disclosed rings, paths, and nodes",